{"status":{"code":0,"name":"OK"},"sigs":[{"seqno":5,"payload_hash":"dfb6eb6630c2d4d29186fb77dc857014b6f14ca79e166150410ea575690120f1","merkle_seqno":6576350,"sig_id":"edf79db945b57bf7967f6a7adc956dc344feff4eb15544b1b0f44c8899239d2b0f","sig_id_short":"7feduUW1e_eWf2p63JVtw0T-_06xVUSxsPRM","kid":"0120ba19de5b0eab9e3b12bf9ab5c197978d326e364e2f7a9b9a4f6d13a746e803770a","sig":"hKRib2R5hqhkZXRhY2hlZMOpaGFzaF90eXBlCqNrZXnEIwEguhneWw6rnjsSv5q1wZeXjTJuNk4vepuaT20Tp0boA3cKp3BheWxvYWTESpcCBcQggj1Jnr0Ya/KORwuuMzVA84t4jRbOucFtkYzfGb2Oe4jEINkZa54qha6WfaYeZLLavB/kexc0E6jeWdzUwz+eOmx2AgHCo3NpZ8RA5lN7grmTj5DgSaTKHMU9e+W0QFxC7iw9fJLcviSDRwTAv9ndiMW4auyvAdIQKItQywpFKt50IQV6R985ePQAA6hzaWdfdHlwZSCkaGFzaIKkdHlwZQildmFsdWXEICze1/Y03/goqM0Hh231FHZhQyCWymAtfzeUEb89sGLwo3RhZ80CAqd2ZXJzaW9uAQ==","payload_json":"{\"body\":{\"key\":{\"eldest_kid\":\"0120ba19de5b0eab9e3b12bf9ab5c197978d326e364e2f7a9b9a4f6d13a746e803770a\",\"host\":\"keybase.io\",\"kid\":\"0120ba19de5b0eab9e3b12bf9ab5c197978d326e364e2f7a9b9a4f6d13a746e803770a\",\"uid\":\"ce788046b816a096d7d5093fee423519\",\"username\":\"intersteller\"},\"merkle_root\":{\"ctime\":1568172016,\"hash\":\"fc7be1861f31b10aedc8fc61b56d9ebafd15f6fa85da7998a3dcb36e9e071d81843efd0297b103cf46ca6f636f7e04b908ee62eab0c4790d06a94d5b7bc8388f\",\"hash_meta\":\"f235b3d0c50c154337725b8f41f78bc4cca348252596750327c6ac97f6d687f5\",\"seqno\":6575960},\"service\":{\"entropy\":\"oJW7/IyeNegVd4Q6mJxMlhUe\",\"name\":\"github\",\"username\":\"esa-security-group\"},\"type\":\"web_service_binding\",\"version\":2},\"client\":{\"name\":\"keybase.io go client\",\"version\":\"4.4.0\"},\"ctime\":1568172134,\"expire_in\":504576000,\"prev\":\"823d499ebd186bf28e470bae333540f38b788d16ceb9c16d918cdf19bd8e7b88\",\"seqno\":5,\"tag\":\"signature\"}","sig_type":2,"sig_version":2,"ctime":1568172134,"etime":2072748134,"rtime":1568439939,"eldest_seqno":1,"sig_status":1,"prev":"823d499ebd186bf28e470bae333540f38b788d16ceb9c16d918cdf19bd8e7b88","proof_id":"28bbb8eb431bc18a9549e910","proof_type":3,"proof_text_check":"hKRib2R5hqhkZXRhY2hlZMOpaGFzaF90eXBlCqNrZXnEIwEguhneWw6rnjsSv5q1wZeXjTJuNk4vepuaT20Tp0boA3cKp3BheWxvYWTESpcCBcQggj1Jnr0Ya/KORwuuMzVA84t4jRbOucFtkYzfGb2Oe4jEINkZa54qha6WfaYeZLLavB/kexc0E6jeWdzUwz+eOmx2AgHCo3NpZ8RA5lN7grmTj5DgSaTKHMU9e+W0QFxC7iw9fJLcviSDRwTAv9ndiMW4auyvAdIQKItQywpFKt50IQV6R985ePQAA6hzaWdfdHlwZSCkaGFzaIKkdHlwZQildmFsdWXEICze1/Y03/goqM0Hh231FHZhQyCWymAtfzeUEb89sGLwo3RhZ80CAqd2ZXJzaW9uAQ==","proof_text_full":"### Keybase proof\n\nI hereby claim:\n\n  * I am esa-security-group on github.\n  * I am intersteller (https://keybase.io/intersteller) on keybase.\n  * I have a public key ASC6Gd5bDqueOxK_mrXBl5eNMm42Ti96m5pPbROnRugDdwo\n\nTo claim this, I am signing this object:\n\n```json\n{\n  \"body\": {\n    \"key\": {\n      \"eldest_kid\": \"0120ba19de5b0eab9e3b12bf9ab5c197978d326e364e2f7a9b9a4f6d13a746e803770a\",\n      \"host\": \"keybase.io\",\n      \"kid\": \"0120ba19de5b0eab9e3b12bf9ab5c197978d326e364e2f7a9b9a4f6d13a746e803770a\",\n      \"uid\": \"ce788046b816a096d7d5093fee423519\",\n      \"username\": \"intersteller\"\n    },\n    \"merkle_root\": {\n      \"ctime\": 1568172016,\n      \"hash\": \"fc7be1861f31b10aedc8fc61b56d9ebafd15f6fa85da7998a3dcb36e9e071d81843efd0297b103cf46ca6f636f7e04b908ee62eab0c4790d06a94d5b7bc8388f\",\n      \"hash_meta\": \"f235b3d0c50c154337725b8f41f78bc4cca348252596750327c6ac97f6d687f5\",\n      \"seqno\": 6575960\n    },\n    \"service\": {\n      \"entropy\": \"oJW7/IyeNegVd4Q6mJxMlhUe\",\n      \"name\": \"github\",\n      \"username\": \"esa-security-group\"\n    },\n    \"type\": \"web_service_binding\",\n    \"version\": 2\n  },\n  \"client\": {\n    \"name\": \"keybase.io go client\",\n    \"version\": \"4.4.0\"\n  },\n  \"ctime\": 1568172134,\n  \"expire_in\": 504576000,\n  \"prev\": \"823d499ebd186bf28e470bae333540f38b788d16ceb9c16d918cdf19bd8e7b88\",\n  \"seqno\": 5,\n  \"tag\": \"signature\"\n}\n```\n\nwith the key [ASC6Gd5bDqueOxK_mrXBl5eNMm42Ti96m5pPbROnRugDdwo](https://keybase.io/intersteller), yielding the signature:\n\n```\nhKRib2R5hqhkZXRhY2hlZMOpaGFzaF90eXBlCqNrZXnEIwEguhneWw6rnjsSv5q1wZeXjTJuNk4vepuaT20Tp0boA3cKp3BheWxvYWTESpcCBcQggj1Jnr0Ya/KORwuuMzVA84t4jRbOucFtkYzfGb2Oe4jEINkZa54qha6WfaYeZLLavB/kexc0E6jeWdzUwz+eOmx2AgHCo3NpZ8RA5lN7grmTj5DgSaTKHMU9e+W0QFxC7iw9fJLcviSDRwTAv9ndiMW4auyvAdIQKItQywpFKt50IQV6R985ePQAA6hzaWdfdHlwZSCkaGFzaIKkdHlwZQildmFsdWXEICze1/Y03/goqM0Hh231FHZhQyCWymAtfzeUEb89sGLwo3RhZ80CAqd2ZXJzaW9uAQ==\n\n```\n\nAnd finally, I am proving ownership of the github account by posting this as a gist.\n\n### My publicly-auditable identity:\n\nhttps://keybase.io/intersteller\n\n### From the command line:\n\nConsider the [keybase command line program](https://keybase.io/download).\n\n```bash\n# look me up\nkeybase id intersteller\n```\n","check_data_json":"{\"entropy\":\"oJW7/IyeNegVd4Q6mJxMlhUe\",\"name\":\"github\",\"username\":\"esa-security-group\"}","remote_id":"","api_url":null,"human_url":null,"proof_state":7,"proof_status":201,"retry_count":1,"hard_fail_count":5,"last_check":1568173681,"last_success":null,"version":3,"is_eldest":0,"fingerprint":""}]}